,labels,text
1978,ham,No I'm in the same boat. Still here at my moms. Check me out on yo. I'm half naked.
3989,spam,(Bank of Granite issues Strong-Buy) EXPLOSIVE PICK FOR OUR MEMBERS *****UP OVER 300% *********** Nasdaq Symbol CDGT That is a $5.00 per..
3935,ham,They r giving a second chance to rahul dengra.
4078,ham,O i played smash bros  &lt;#&gt;  religiously.
4086,spam,PRIVATE! Your 2003 Account Statement for 07973788240 shows 800 un-redeemed S. I. M. points. Call 08715203649 Identifier Code: 40533 Expires 31/10/04
4919,ham,"G says you never answer your texts, confirm/deny"
2268,spam,88066 FROM 88066 LOST 3POUND HELP
4696,ham,"Okey dokey, iÛ÷ll be over in a bit just sorting some stuff out."
3653,ham,Why i come in between you people
70,ham,Wah lucky man... Then can save money... Hee...
4467,ham,Much better now thanks lol
2418,ham,"Madam,regret disturbance.might receive a reference check from DLF Premarica.kindly be informed.Rgds,Rakhesh,Kerala."
2623,ham,I'm coming home 4 dinner.
1272,ham,Ok...
1454,ham,Can Ì_ all decide faster cos my sis going home liao..
831,ham,Hi mate its RV did u hav a nice hol just a message 3 say hello coz havenåÕt sent u 1 in ages started driving so stay off roads!RVx
5082,ham,Amazing : If you rearrange these letters it gives the same meaning... Dormitory = Dirty room Astronomer = Moon starer The eyes = They see Election results = Lies lets recount Mother-in-law = Woman Hitler Eleven plus two =Twelve plus one Its Amazing... !:-)
1893,ham,Good Morning plz call me sir
3269,ham,K actually can you guys meet me at the sunoco on howard? It should be right on the way
238,ham,"New Theory: Argument wins d SITUATION, but loses the PERSON. So dont argue with ur friends just.. . . . kick them &amp; say, I'm always correct.!"
5426,ham,Oh yeah! And my diet just flew out the window
4867,ham,"Watching cartoon, listening music &amp; at eve had to go temple &amp; church.. What about u?"
3435,ham,If india win or level series means this is record:)
5542,ham,Armand says get your ass over to epsilon
1295,ham,TELL HER I SAID EAT SHIT.
2998,ham,"Oh, then your phone phoned me but it disconnected"
1001,spam,Please call our customer service representative on FREEPHONE 0808 145 4742 between 9am-11pm as you have WON a guaranteed å£1000 cash or å£5000 prize!
1512,ham,"Hey sweet, I was wondering when you had a moment if you might come to me ? I want to send a file to someone but it won't go over yahoo for them because their connection sucks, remember when you set up that page for me to go to and download the format disc ? Could you tell me how to do that ? Or do you know some other way to download big files ? Because they can download stuff directly from the internet. Any help would be great, my prey ... *teasing kiss*"
4370,ham,Purity of friendship between two is not about smiling after reading the forwarded message..Its about smiling just by seeing the name. Gud evng
3458,spam,Not heard from U4 a while. Call me now am here all night with just my knickers on. Make me beg for it like U did last time 01223585236 XX Luv Nikiyu4.net
2350,ham,You will be in the place of that man
957,ham,Welp apparently he retired
2229,ham,haha but no money leh... Later got to go for tuition... Haha and looking for empty slots for driving lessons
4301,ham,Aiyar hard 2 type. U later free then tell me then i call n scold n tell u.
2240,ham,K I'll call you when I'm close
1437,ham,Wat so late still early mah. Or we juz go 4 dinner lor. Aiya i dunno...
5351,ham,Yup it's at paragon... I havent decided whether 2 cut yet... Hee...
1876,ham,Watching tv now. I got new job :)
2094,spam,PRIVATE! Your 2004 Account Statement for 07742676969 shows 786 unredeemed Bonus Points. To claim call 08719180248 Identifier Code: 45239 Expires
2655,ham,Great! I have to run now so ttyl!
3482,ham,"Hello, my love! How goes that day ? I wish your well and fine babe and hope that you find some job prospects. I miss you, boytoy ... *a teasing kiss*"
1034,ham,ZOE IT JUST HIT ME 2 IM FUCKING SHITIN MYSELF IL DEFO TRY MY HARDEST 2 CUM 2MOROW LUV U MILLIONS LEKDOG
4764,ham,if you text on your way to cup stop that should work. And that should be BUS
931,ham,Congratulations ore mo owo re wa. Enjoy it and i wish you many happy moments to and fro wherever you go
5087,ham,"Good morning, im suffering from fever and dysentry ..will not be able to come to office today."
2902,ham,Tell me pa. How is pain de.
633,ham,Got it. Seventeen pounds for seven hundred ml ÛÒ hope ok.
2451,ham,I know complain num only..bettr directly go to bsnl offc nd apply for it..
498,ham,"Kate jackson rec center before 7ish, right?"
4935,ham,K..k.:)congratulation ..
415,ham,Whatsup there. Dont u want to sleep
2698,spam,FROM 88066 LOST å£12 HELP
2855,ham,"Japanese Proverb: If one Can do it, U too Can do it, If none Can do it,U must do it Indian version: If one Can do it, LET HIM DO it.. If none Can do it,LEAVE it!! And finally Kerala version: If one can do it, Stop him doing it.. If none can do it, Make a strike against it ..."
3727,ham,The search 4 happiness is 1 of d main sources of unhappiness! Accept life the way it comes! U will find happiness in every moment u live.
1426,ham,Ok...
757,ham,"Faith makes things possible,Hope makes things work,Love makes things beautiful,May you have all three this Christmas!Merry Christmas!"
1194,ham,Ok... C ya...
1041,ham,I'm in class. Will holla later
1777,spam,Buy Space Invaders 4 a chance 2 win orig Arcade Game console. Press 0 for Games Arcade (std WAP charge) See o2.co.uk/games 4 Terms + settings. No purchase
2572,ham,"The house is on the water with a dock, a boat rolled up with a newscaster who dabbles in jazz flute behind the wheel"
2699,ham,Oh baby of the house. How come you dont have any new pictures on facebook
2168,ham,Thx. All will be well in a few months
596,ham,Gud mrng dear have a nice day
1919,ham,Yar i wanted 2 scold u yest but late already... I where got zhong se qing you? If u ask me b4 he ask me then i'll go out w u all lor. N u still can act so real.
2763,ham,"Say this slowly.? GOD,I LOVE YOU &amp; I NEED YOU,CLEAN MY HEART WITH YOUR BLOOD.Send this to Ten special people &amp; u c miracle tomorrow, do it,pls,pls do it..."
2807,ham,Yes princess! I want to catch you with my big strong hands...
652,ham,"Wait, do you know if wesleys in town? I bet she does hella drugs!"
5151,ham,No problem with the renewal. I.ll do it right away but i dont know his details.
3024,ham,"What part of \don't initiate\"" don't you understand"""
3271,ham,"MOON has come to color your dreams, STARS to make them musical and my SMS to give you warm and Peaceful Sleep. Good Night"
4113,ham,Where are you ? What do you do ? How can you stand to be away from me ? Doesn't your heart ache without me ? Don't you wonder of me ? Don't you crave me ?
1406,spam,"URGENT, IMPORTANT INFORMATION FOR O2 USER. TODAY IS YOUR LUCKY DAY! 2 FIND OUT WHY LOG ONTO HTTP://WWW.URAWINNER.COM THERE IS A FANTASTIC SURPRISE AWAITING FOR YOU"
1618,ham,The 2 oz guy is being kinda flaky but one friend is interested in picking up $ &lt;#&gt;  worth tonight if possible
75,ham,I am waiting machan. Call me once you free.
1964,ham,"Honeybee Said: *I'm d Sweetest in d World* God Laughed &amp; Said: *Wait,U Havnt Met d Person Reading This Msg* MORAL: Even GOD Can Crack Jokes! GM+GN+GE+GN:)"
3336,ham,I AM AT THE GAS STATION. GO THERE.
3842,ham,Yes ammae....life takes lot of turns you can only sit and try to hold the steering...
5358,ham,Hmm. Shall i bring a bottle of wine to keep us amused? Just joking! I'll still bring a bottle. Red or white? See you tomorrow
4510,ham,"Sorry I missed you babe. I was up late and slept in. I hope you enjoy your driving lesson, boytoy. I miss you too ... *teasing kiss*"
2410,ham,Ok... Thanx... Gd nite 2 Ì_ too...
2988,spam,No 1 POLYPHONIC tone 4 ur mob every week! Just txt PT2 to 87575. 1st Tone FREE ! so get txtin now and tell ur friends. 150p/tone. 16 reply HL 4info
2164,ham,"Nothing really, just making sure everybody's up to speed"
3085,ham,I wish that I was with you. Holding you tightly. Making you see how important you are. How much you mean to me ... How much I need you ... In my life ...
1010,ham,Lol I would but my mom would have a fit and tell the whole family how crazy and terrible I am
1029,ham,"Its good, we'll find a way"
1745,ham,"IåÕm cool ta luv but v.tired 2 cause i have been doin loads of planning all wk, we have got our social services inspection at the nursery! Take care & spk sn x."
828,ham,"Sorry light turned green, I meant another friend wanted  &lt;#&gt;  worth but he may not be around"
1345,ham,Que pases un buen tiempo or something like that
96,ham,Watching telugu movie..wat abt u?
3807,ham,Mm you ask him to come its enough :-)
4279,spam,WINNER!! As a valued network customer you have been selected to receivea å£900 prize reward! To claim call 09061701461. Claim code KL341. Valid 12 hours only.
2977,ham,Yar lor... Keep raining non stop... Or u wan 2 go elsewhere?
1200,ham,Otherwise had part time job na-tuition..
621,ham,Good words.... But words may leave u in dismay many times.
566,ham,Oooh bed ridden ey? What are YOU thinking of?
543,ham,4 oclock at mine. Just to bash out a flat plan.
4100,spam,GSOH? Good with SPAM the ladies?U could b a male gigolo? 2 join the uk's fastest growing mens club reply ONCALL. mjzgroup. 08714342399.2stop reply STOP. msg@å£1.50rcvd
51,ham,"A gram usually runs like  &lt;#&gt; , a half eighth is smarter though and gets you almost a whole second gram for  &lt;#&gt;"
4820,ham,Im good! I have been thinking about you...
3039,ham,One day a crab was running on the sea shore..The waves came n cleared the footprints of the crab.. Crab asked: being my frnd y r u clearing my beautiful footprints? Waves replied: A fox was following ur footprints to catch you! thats y i cleared it off:) frndsship never lets u dwn :-) GUD nyt..
745,ham,Dunno he jus say go lido. Same time 930.
3940,spam,"Free Msg: get Gnarls Barkleys \Crazy\"" ringtone TOTALLY FREE just reply GO to this message right now!"""
1480,ham,Have you always been saying welp?
5314,spam,Get the official ENGLAND poly ringtone or colour flag on yer mobile for tonights game! Text TONE or FLAG to 84199. Optout txt ENG STOP Box39822 W111WX å£1.50
195,ham,Gud mrng dear hav a nice day
2559,ham,I also thk too fast... Xy suggest one not me. U dun wan it's ok. Going 2 rain leh where got gd.
1302,ham,"FRAN I DECIDED 2 GO N E WAY IM COMPLETELY BROKE AN KNACKERED I GOT UP BOUT 3 C U 2MRW LOVE JANX P.S THIS IS MY DADS FONE, -NO CREDIT"
3297,spam,This message is free. Welcome to the new & improved Sex & Dogging club! To unsubscribe from this service reply STOP. msgs@150p 18 only
802,spam,FREE for 1st week! No1 Nokia tone 4 ur mobile every week just txt NOKIA to 8077 Get txting and tell ur mates. www.getzed.co.uk POBox 36504 W45WQ 16+ norm150p/tone
3717,ham,Cool. Do you like swimming? I have a pool and jacuzzi at my house.
4638,ham,Of course. I guess god's just got me on hold right now.
1322,ham,Oh just getting even with u.... u?
3674,ham,Whos this am in class:-)
4248,ham,Loosu go to hospital. De dont let it careless.
3611,ham,"K, my roommate also wants a dubsack and another friend may also want some so plan on bringing extra, I'll tell you when they know for sure"
4605,ham,"Oh... Haha... Den we shld had went today too... Gee, nvm la... Kaiez, i dun mind goin jazz oso... Scared hiphop open cant catch up... "
4031,ham,I'm very happy for you babe ! Woo hoo party on dude!
644,ham,Allo! We have braved the buses and taken on the trains and triumphed. I mean weÛ÷re in bÛ÷ham. Have a jolly good rest of week
1488,ham,Tell them no need to investigate about me anywhere.
4181,spam,"Urgent! Please call 0906346330. Your ABTA complimentary 4* Spanish Holiday or å£10,000 cash await collection SAE T&Cs BOX 47 PO19 2EZ 150ppm 18+"
1864,ham,You call him now ok i said call him
120,spam,"URGENT! Your Mobile No. was awarded å£2000 Bonus Caller Prize on 5/9/03 This is our final try to contact U! Call from Landline 09064019788 BOX42WR29C, 150PPM"
4486,ham,Miss call miss call khelate kintu opponenter miss call dhorte lage. Thats d rule. One with great phone receiving quality wins.
3226,ham,Wife.how she knew the time of murder exactly
2024,ham,U having lunch alone? I now so bored...
4482,ham,True lov n care wil nevr go unrecognized. though somone often makes mistakes when valuing it. but they will definitly undrstnd once when they start missing it.
4329,ham,i thought we were doing a king of the hill thing there.
3929,ham,I thk Ì_ gotta go home by urself. Cos i'll b going out shopping 4 my frens present. 
3656,ham,Studying. But i.ll be free next weekend.
3023,ham,I love ya too but try and budget your money better babe. Gary would freak on me if he knew
4857,ham,Ok...
2815,ham,Genius what's up. How your brother. Pls send his number to my skype.
134,spam,Want 2 get laid tonight? Want real Dogging locations sent direct 2 ur mob? Join the UK's largest Dogging Network bt Txting GRAVEL to 69888! Nt. ec2a. 31p.msg@150p
3038,ham,"Wishing you and your family Merry \X\"" mas and HAPPY NEW Year in advance.."""
1918,ham,Is fujitsu s series lifebook good?
3456,ham,Friendship poem: Dear O Dear U R Not Near But I Can Hear Dont Get Fear Live With Cheer No More Tear U R Always my Dear. Gud ni8
4681,ham,"Haha yeah, 2 oz is kind of a shitload"
1578,ham,How to Make a girl Happy? It's not at all difficult to make girls happy. U only need to be... 1. A friend 2. Companion 3. Lover 4. Chef . . .  &lt;#&gt; . Good listener  &lt;#&gt; . Organizer  &lt;#&gt; . Good boyfriend  &lt;#&gt; . Very clean  &lt;#&gt; . Sympathetic  &lt;#&gt; . Athletic  &lt;#&gt; . Warm . . .  &lt;#&gt; . Courageous  &lt;#&gt; . Determined  &lt;#&gt; . True  &lt;#&gt; . Dependable  &lt;#&gt; . Intelligent . . .  &lt;#&gt; . Psychologist  &lt;#&gt; . Pest exterminator  &lt;#&gt; . Psychiatrist  &lt;#&gt; . Healer . .  &lt;#&gt; . Stylist  &lt;#&gt; . Driver . . Aaniye pudunga venaam..
1788,ham,Arun can u transfr me d amt
511,ham,Prabha..i'm soryda..realy..frm heart i'm sory
62,ham,Its a part of checking IQ
3724,ham,Nothing spl..wat abt u and whr ru?
2890,ham,"Yeah there's quite a bit left, I'll swing by tomorrow when I get up"
3372,ham,"Looks like you found something to do other than smoke, great job!"
3213,ham,"Babe, have you got enough money to pick up bread and milk ? And I'll give you it back when you get home ?"
1973,ham,I had askd u a question some hours before. Its answer
122,spam,Todays Voda numbers ending 7548 are selected to receive a $350 award. If you have a match please call 08712300220 quoting claim code 4041 standard rates app
2298,ham,Dont pick up d call when something important is There to tell. Hrishi
3560,spam,Text BANNEDUK to 89555 to see! cost 150p textoperator g696ga 18+ XXX
4844,ham,Missing you too.pray inshah allah
4722,ham,HELLO PEACH! MY CAKE TASTS LUSH!
1210,ham,Guessin you ain't gonna be here before 9?
567,ham,"So anyways, you can just go to your gym or whatever, my love *smiles* I hope your ok and having a good day babe ... I miss you so much already"
3651,ham,"Probably not, still going over some stuff here"
3942,ham,I got a call from a landline number. . . I am asked to come to anna nagar . . . I will go in the afternoon
864,ham,Dude ive been seeing a lotta corvettes lately
4224,ham,"\The world suffers a lot... Not because of the violence of bad people. But because of the silence of good people!\"""
3893,spam,Dear Dave this is your final notice to collect your 4* Tenerife Holiday or #5000 CASH award! Call 09061743806 from landline. TCs SAE Box326 CW25WX 150ppm
4443,ham,COME BACK TO TAMPA FFFFUUUUUUU
1741,ham,I can do that! I want to please you both inside and outside the bedroom...
2618,ham,Hey pple...$700 or $900 for 5 nights...Excellent location wif breakfast hamper!!!
720,ham,Oh is it? Send me the address
3349,ham,Sorry i cant take your call right now. It so happens that there r 2waxsto do wat you want. She can come and ill get her medical insurance. And she'll be able to deliver and have basic care. I'm currently shopping for the right medical insurance for her. So just give me til friday morning. Thats when i.ll see the major person that can guide me to the right insurance.
2509,ham,"U wake up already? Wat u doing? U picking us up later rite? I'm taking sq825, reaching ard 7 smth 8 like dat. U can check e arrival time. C ya soon..."
690,ham,Was the farm open?
602,ham,Speaking of does he have any cash yet?
4755,ham,Don't make life too stressfull.. Always find time to Laugh.. It may not add years to your Life! But surely adds more life to ur years!! Gud ni8..swt dreams..
1756,ham,Lmao ok I wont be needing u to do my hair anymore.
1782,ham,My uncles in Atlanta. Wish you guys a great semester.
2569,ham,Ultimately tor motive tui achieve korli.
2170,ham,\CAN I PLEASE COME UP NOW IMIN TOWN.DONTMATTER IF URGOIN OUTL8R
4190,ham,"Each Moment in a day,has its own value-Morning brings hope,afternoon brings faith,Evening brings luv,Night brings rest,Wish u find them all today.Good Morning"
318,spam,December only! Had your mobile 11mths+? You are entitled to update to the latest colour camera mobile for Free! Call The Mobile Update Co FREE on 08002986906
3352,ham,I emailed yifeng my part oredi.. Can Ì_ get it fr him..
274,ham,No objection. My bf not coming.
4797,ham,Just come home. I don't want u to be miserable
4327,spam,"Congrats! 2 mobile 3G Videophones R yours. call 09061744553 now! videochat wid ur mates, play java games, Dload polyH music, noline rentl. bx420. ip4. 5we. 150pm"
4668,ham,"When I was born, GOD said, \Oh No! Another IDIOT\"". When you were born"
4375,spam,"If you don't, your prize will go to another customer. T&C at www.t-c.biz 18+ 150p/min Polo Ltd Suite 373 London W1J 6HL Please call back if busy"
1507,ham,"Wen ur lovable bcums angry wid u, dnt take it seriously.. Coz being angry is d most childish n true way of showing deep affection, care n luv!.. kettoda manda... Have nice day da."
1840,ham,Yeah. I got a list with only u and Joanna if I'm feeling really anti social
4387,ham,"see you then, we're all christmassy here!"
5373,ham,"K I'll head out in a few mins, see you there"
295,spam,T-Mobile customer you may now claim your FREE CAMERA PHONE upgrade & a pay & go sim card for your loyalty. Call on 0845 021 3680.Offer ends 28thFeb.T&C's apply
4306,ham,I guess it is useless calling u 4 something important.
2694,ham,Hey sexy buns! What of that day? No word from you this morning on YM ... :-( ... I think of you
298,ham,I cant pick the phone right now. Pls send a message
68,spam,"Did you hear about the new \Divorce Barbie\""? It comes with all of Ken's stuff!"""
736,ham,Thanks for looking out for me. I really appreciate.
5523,ham,Going to join tomorrow.
3109,spam,Good Luck! Draw takes place 28th Feb 06. Good Luck! For removal send STOP to 87239 customer services 08708034412
1550,ham,He says hi and to get your ass back to south tampa (preferably at a kegger)
150,ham,The wine is flowing and i'm i have nevering..
756,ham,Cant think of anyone with * spare room off * top of my head
1501,spam,"HOT LIVE FANTASIES call now 08707509020 Just 20p per min NTT Ltd, PO Box 1327 Croydon CR9 5WB 0870 is a national rate call"
3053,ham,What happened to our yo date?
2957,spam,U have a secret admirer. REVEAL who thinks U R So special. Call 09065174042. To opt out Reply REVEAL STOP. 1.50 per msg recd. Cust care 07821230901
2333,ham,What happen to her tell the truth
2057,ham,"Nothing, i got msg frm tht unknown no.."
376,ham,You could have seen me..i did't recognise you Face.:)
1499,spam,"SMS. ac JSco: Energy is high, but u may not know where 2channel it. 2day ur leadership skills r strong. Psychic? Reply ANS w/question. End? Reply END JSCO"
859,ham,Did he just say somebody is named tampa
1351,ham,Yo theres no class tmrw right?
4757,spam,URGENT! Your Mobile number has been awarded with a å£2000 prize GUARANTEED. Call 09061790121 from land line. Claim 3030. Valid 12hrs only 150ppm
2916,ham,Yes. that will be fine. Love you. Be safe.
378,ham,Keep my payasam there if rinu brings
3877,ham,What you need. You have a person to give na.
1294,ham,Aiyah u did ok already lar. E nydc at wheellock?
1379,spam,No. 1 Nokia Tone 4 ur mob every week! Just txt NOK to 87021. 1st Tone FREE ! so get txtin now and tell ur friends. 150p/tone. 16 reply HL 4info
2792,ham,Not from this campus. Are you in the library?
2812,ham,"Enjoy the showers of possessiveness poured on u by ur loved ones, bcoz in this world of lies, it is a golden gift to be loved truly.."
4690,ham,Surly ill give it to you:-) while coming to review.
3090,spam,LORD OF THE RINGS:RETURN OF THE KING in store NOW!REPLY LOTR by 2 June 4 Chance 2 WIN LOTR soundtrack CDs StdTxtRate. Reply STOP to end txts
841,ham,"Pls send me a comprehensive mail about who i'm paying, when and how much."
5377,spam,The current leading bid is 151. To pause this auction send OUT. Customer Care: 08718726270
2042,ham,"Me not waking up until 4 in the afternoon, sup"
175,ham,Let me know when you've got the money so carlos can make the call
4066,spam,"You are being contacted by our Dating Service by someone you know! To find out who it is, call from your mobile or landline 09064017305 PoBox75LDNS7 "
927,ham,K:)i will give my kvb acc details:)
3063,ham,Ok. How many should i buy.
45,ham,No calls..messages..missed calls
1260,ham,"Yo, I'm at my parents' gettin cash. Good news: we picked up a downstem"
1096,spam,Dear Subscriber ur draw 4 å£100 gift voucher will b entered on receipt of a correct ans. When was Elvis Presleys Birthday? TXT answer to 80062
2706,ham,S now only i took tablets . Reaction morning only.
1902,ham,My sister got placed in birla soft da:-)
4739,ham,"I keep seeing weird shit and bein all \woah\"" then realising it's actually reasonable and I'm all \""oh\"""""
2535,ham,"Can you pls pls send me a mail on all you know about relatives coming to deliver here? All you know about costs, risks, benefits and anything else. Thanks."
1030,ham,Can not use foreign stamps in this country. Good lecture .
1869,ham,Mom wants to know where you at
3836,ham,Early bird! Any purchases yet?
2197,ham,Bring it if you got it
283,ham,Okie...
2173,ham,"Hiya, had a good day? Have you spoken to since the weekend?"
4888,ham,"Japanese Proverb: If one Can do it, U too Can do it, If none Can do it,U must do it Indian version: If one Can do it, LET HIM DO it.. If none Can do it,LEAVE it!! And finally Kerala version: If one can do it, Stop him doing it.. If none can do it, Make a strike against it ..."
3210,ham,"OH YEAH,AND HAV A GREAT TIME IN NEWQUAY-SEND ME A POSTCARD !1 LOOK AFTER ALL THE GIRLS WHILE IM GONE(U KNOW THE 1IM TALKIN BOUT!)xx"
4553,ham,Try to do something dear. You read something for exams
1616,ham,"K, makes sense, btw carlos is being difficult so you guys are gonna smoke while I go pick up the second batch and get gas"
5452,ham,What???? Hello wats talks email address?
4006,ham,I'm reaching home in 5 min.
1371,ham,I though we shd go out n have some fun so bar in town or something ÛÒ sound ok?
2683,ham,I'm okay. Chasing the dream. What's good. What are you doing next.
4266,ham,SORRY IM STIL FUCKED AFTER LAST NITE WENT TOBED AT 430 GOT UP 4 WORK AT 630
2115,ham,Well I wasn't available as I washob nobbing with last night so they had to ask Nickey Platt instead of me!;
1907,ham,ELLO BABE U OK?
2271,ham,Life spend with someone for a lifetime may be meaningless but a few moments spent with someone who really love you means more than life itself..
3323,ham,I don wake since. I checked that stuff and saw that its true no available spaces. Pls call the embassy or send a mail to them.
4759,ham,I'm home. Doc gave me pain meds says everything is fine.
1456,ham,U sleeping now.. Or you going to take? Haha.. I got spys wat.. Me online checking n replying mails lor..
3007,spam,"Loan for any purpose å£500 - å£75,000. Homeowners + Tenants welcome. Have you been previously refused? We can still help. Call Free 0800 1956669 or text back 'help'"
5080,ham,"Yeah, give me a call if you've got a minute"
257,ham,Where are you lover ? I need you ...
507,ham,You should know now. So how's anthony. Are you bringing money. I've school fees to pay and rent and stuff like that. Thats why i need your help. A friend in need....|
3105,ham,"I had been hoping i would not have to send you this message. My rent is due and i dont have enough for it. My reserves are completely gone. Its a loan i need and was hoping you could her. The balance is  &lt;#&gt; . Is there a way i could get that from you, till mid march when i hope to pay back."
99,ham,Please don't text me anymore. I have nothing else to say.
2940,ham,My supervisor find 4 me one lor i thk his students. I havent ask her yet. Tell u aft i ask her.
2004,ham,"Goodmorning, today i am late for  &lt;DECIMAL&gt; min."
5398,ham,Hi. Hope you had a good day. Have a better night.
4519,ham,What to think no one saying clearly. Ok leave no need to ask her. I will go if she come or not
2209,ham,"Hmm well, night night "
1740,spam,UR GOING 2 BAHAMAS! CallFREEFONE 08081560665 and speak to a live operator to claim either Bahamas cruise ofå£2000 CASH 18+only. To opt out txt X to 07786200117
2722,ham,It's justbeen overa week since we broke up and already our brains are going to mush!
4127,ham,I dont thnk its a wrong calling between us
4028,ham,"[Û_] anyway, many good evenings to u! s"
4562,ham,"Come around  &lt;DECIMAL&gt; pm vikky..i'm otside nw, il come by tht time"
366,spam,"Update_Now - Xmas Offer! Latest Motorola, SonyEricsson & Nokia & FREE Bluetooth! Double Mins & 1000 Txt on Orange. Call MobileUpd8 on 08000839402 or call2optout/F4Q="
5065,ham,I calls you later. Afternoon onwords mtnl service get problem in south mumbai. I can hear you but you cann't listen me.
5419,ham,I'm at bruce &amp; fowler now but I'm in my mom's car so I can't park (long story)
4318,ham,Are you still playing with gautham?
