,labels,text
3401,ham,"'An Amazing Quote'' - \Sometimes in life its difficult to decide whats wrong!! a lie that brings a smile or the truth that brings a tear....\"""""
1389,ham,"Haha... Where got so fast lose weight, thk muz go 4 a month den got effect... Gee,later we go aust put bk e weight."
3564,ham,"We know TAJ MAHAL as symbol of love. But the other lesser known facts 1. Mumtaz was Shahjahan's 4th wife, out of his 7 wifes. 2. Shahjahan killed Mumtaz's husband to marry her. 3. Mumtaz died in her  &lt;#&gt; th delivery. 4. He then married Mumtaz's sister. Question arises where the Hell is the LOVE?:-| -The Great Hari-"
884,ham,Yoyyooo u know how to change permissions for a drive in mac. My usb flash drive
1868,ham,Today my system sh get ready.all is well and i am also in the deep well
10,ham,"I'm gonna be home soon and i don't want to talk about this stuff anymore tonight, k? I've cried enough today."
3415,ham,Uhhhhrmm isnt having tb test bad when youre sick
1463,ham,Ok good then i later come find Ì_... C lucky i told Ì_ to go earlier... Later pple take finish Ì_ no more again...
806,ham,"sure, but make sure he knows we ain't smokin yet"
4386,ham,S.i'm watching it in live..
4068,ham,Hope youåÕre not having too much fun without me!! see u tomorrow love jess x
2108,spam,"FREE2DAY sexy St George's Day pic of Jordan!Txt PIC to 89080 dont miss out, then every wk a saucy celeb!4 more pics c PocketBabe.co.uk 0870241182716 å£3/wk"
4711,ham,Thats cool princess! I will cover your face in hot sticky cum :)
5521,ham,You are a big chic. Common. Declare
2234,ham,What's your room number again? Wanna make sure I'm knocking on the right door
963,ham,Yo chad which gymnastics class do you wanna take? The site says Christians class is full..
2632,ham,I WILL CAL YOU SIR. In meeting
704,ham,True dear..i sat to pray evening and felt so.so i sms'd you in some time...
431,ham,Does she usually take fifteen fucking minutes to respond to a yes or no question
145,ham,Whats the staff name who is taking class for us?
2033,ham,IM GONNA MISS U SO MUCH
4680,ham,Are you staying in town ?
1165,ham,"Haha yeah I see that now, be there in a sec"
3500,ham,says the  &lt;#&gt;  year old with a man and money. I'm down to my last  &lt;#&gt; . Still waiting for that check.
2050,ham,Hi where you. You in home or calicut?
3760,ham,Was just about to ask. Will keep this one. Maybe that's why you didn't get all the messages we sent you on glo
2624,ham,S da..al r above  &lt;#&gt;
4446,ham,Please tell me you have some of that special stock you were talking about
4322,ham,Aight well keep me informed
2424,ham,Oh k k:)but he is not a big hitter.anyway good
1262,spam,"Hungry gay guys feeling hungry and up 4 it, now. Call 08718730555 just 10p/min. To stop texts call 08712460324 (10p/min)"
1771,ham,Watching tv now. I got new job :)
3511,ham,Already one guy loving you:-.
271,ham,"Night has ended for another day, morning has come in a special way. May you smile like the sunny rays and leaves your worries at the blue blue bay."
244,ham,U don't remember that old commercial?
2032,ham,"Yes, i'm small kid.. And boost is the secret of my energy.."
4409,ham,You also didnt get na hi hi hi hi hi
813,ham,I borrow ur bag ok.
3810,ham,Excellent! Wish we were together right now!
4529,ham,Don't forget though that I love you .... And I walk beside you. Watching over you and keeping your heart warm.
1804,ham,The bus leaves at  &lt;#&gt; 
2461,ham,Anything lar...
545,ham,Then any special there?
3241,ham,Good Morning my Dear........... Have a great &amp; successful day.
738,ham,Wish i were with you now!
310,ham,Today is ACCEPT DAY..U Accept me as? Brother Sister Lover Dear1 Best1 Clos1 Lvblefrnd Jstfrnd Cutefrnd Lifpartnr Belovd Swtheart Bstfrnd No rply means enemy
3521,ham,"Im sorry bout last nite it wasnåÕt ur fault it was me, spouse it was pmt or sumthin! U 4give me? I think u shldxxxx"
1131,ham,"Sorry, I'll call later"
5482,spam,URGENT We are trying to contact you Last weekends draw shows u have won a å£1000 prize GUARANTEED Call 09064017295 Claim code K52 Valid 12hrs 150p pm
4111,ham,"I'll see, but prolly yeah"
2769,spam,Burger King - Wanna play footy at a top stadium? Get 2 Burger King before 1st Sept and go Large or Super with Coca-Cola and walk out a winner
920,ham,When u wana see it then
3587,ham,If you were/are free i can give. Otherwise nalla adi entey nattil kittum
3959,ham,I sent lanre fakeye's Eckankar details to the mail box
38,ham,Anything lor... U decide...
4278,spam,"URGENT. Important information for 02 user. Today is your lucky day! 2 find out why , log onto http://www.urawinner.com there is a fantastic surprise awaiting you !"
2983,ham,"He said that he had a right giggle when he saw u again! You would possibly be the first person2die from NVQ, but think how much you could for! "
5559,ham,if you aren't here in the next  &lt;#&gt;  hours imma flip my shit
2667,ham,Why de. You looking good only:-)..
3223,ham,Sorry da thangam.it's my mistake.
1182,ham,"K give me a sec, breaking a  &lt;#&gt;  at cstore"
614,ham,I called and said all to him:)then he have to choose this future.
5467,spam,Get your garden ready for summer with a FREE selection of summer bulbs and seeds worth å£33:50 only with The Scotsman this Saturday. To stop go2 notxt.co.uk
1466,ham,Your account has been refilled successfully by INR  &lt;DECIMAL&gt; . Your KeralaCircle prepaid account balance is Rs  &lt;DECIMAL&gt; . Your Transaction ID is KR &lt;#&gt; .
3042,ham,Your bill at 3 is å£33.65 so thats not bad!
934,spam,"Dear Matthew please call 09063440451 from a landline, your complimentary 4*Lux Tenerife holiday or å£1000 CASH await collection. ppm150 SAE T&Cs Box334 SK38XH."
2419,spam,SMS SERVICES For your inclusive text credits pls gotto www.comuk.net login 3qxj9 unsubscribe with STOP no extra charge help 08702840625 comuk.220cm2 9AE
5032,ham,"* Was really good to see you the other day dudette, been missing you!"
4518,ham,"Just got part Nottingham - 3 hrs 63miles. Good thing i love my man so much, but only doing 40mph. Hey ho"
826,ham,Hahaha..use your brain dear
1521,ham,Are you angry with me. What happen dear
2930,ham,Hi' Test on  &lt;#&gt; rd ....
4232,ham,My love ... I hope your not doing anything drastic. Don't you dare sell your pc or your phone ...
628,spam,New TEXTBUDDY Chat 2 horny guys in ur area 4 just 25p Free 2 receive Search postcode or at gaytextbuddy.com. TXT ONE name to 89693
3853,ham,oh ya... Got hip hop open. Haha i was thinking can go for jazz then zoom to cine... Actually tonight i'm free leh... And there's a kb lesson tonight
390,ham,Huh so late... Fr dinner?
4345,ham,You still around? I could use a half-8th
5430,ham,"If you can make it any time tonight or whenever you can it's cool, just text me whenever you're around"
3990,ham,I am on the way to ur home
400,spam,"FREE RINGTONE text FIRST to 87131 for a poly or text GET to 87131 for a true tone! Help? 0845 2814032 16 after 1st free, tones are 3xå£150pw to eå£nd txt stop"
3359,ham,Please attend the phone:)
46,ham,Didn't you get hep b immunisation in nigeria.
5346,ham,"My Parents, My Kidz, My Friends n My Colleagues. All screaming.. SURPRISE !! and I was waiting on the sofa.. ... ..... ' NAKED...!"
5485,ham,Also fuck you and your family for going to rhode island or wherever the fuck and leaving me all alone the week I have a new bong &gt;:(
3642,ham,"Sorry, left phone upstairs. OK, might be hectic but would be all my birds with one fell swoop. It's a date."
3726,ham,"Aldrine, rakhesh ex RTM here.pls call.urgent."
5409,ham,There is a first time for everything :)
2421,ham,Err... Cud do. I'm going to  at 8pm. I haven't got a way to contact him until then.
1750,ham,Got it..mail panren paru..
5387,ham,I will be gentle baby! Soon you will be taking all  &lt;#&gt;  inches deep inside your tight pussy...
4564,ham,"Honeybee Said: *I'm d Sweetest in d World* God Laughed &amp; Said: *Wait,U Havnt Met d Person Reading This Msg* MORAL: Even GOD Can Crack Jokes! GM+GN+GE+GN:)"
4062,ham,How are you. Its been ages. How's abj
338,ham,"Sorry, I'll call later"
215,ham,Finally the match heading towards draw as your prediction.
3663,ham,Huh? 6 also cannot? Then only how many mistakes?
1341,ham,Just chill for another 6hrs. If you could sleep the pain is not a surgical emergency so see how it unfolds. Okay
5100,ham,"Aight, call me once you're close"
3894,ham,Yes. Last  practice
3640,spam,"You can stop further club tones by replying \STOP MIX\"" See my-tone.com/enjoy. html for terms. Club tones cost GBP4.50/week. MFL"
329,ham,I'm reading the text i just sent you. Its meant to be a joke. So read it in that light
3004,ham,Ew are you one of them?
5327,ham,Wishing you a wonderful week.
3115,ham,Uncle Abbey! Happy New Year. Abiola
5570,ham,The guy did some bitching but I acted like i'd be interested in buying something else next week and he gave it to us for free
2322,ham,Should I be stalking u?
4197,spam,"Want to funk up ur fone with a weekly new tone reply TONES2U 2 this text. www.ringtones.co.uk, the original n best. Tones 3GBP network operator rates apply"
3549,ham,"Dad wanted to talk about the apartment so I got a late start, omw now"
1458,ham,"Fighting with the world is easy, u either win or lose bt fightng with some1 who is close to u is dificult if u lose - u lose if u win - u still lose."
171,ham,"Hmmm.. Thk sure got time to hop ard... Ya, can go 4 free abt... Muz call u to discuss liao... "
4203,ham,How are you enjoying this semester? Take care brother.
4670,ham,"Probably not, I'm almost out of gas and I get some cash tomorrow"
3569,spam,Customer Loyalty Offer:The NEW Nokia6650 Mobile from ONLY å£10 at TXTAUCTION! Txt word: START to No: 81151 & get yours Now! 4T&Ctxt TC 150p/MTmsg
4226,ham,Buy one egg for me da..please:)
4547,ham,Hope you are having a good week. Just checking in
5117,ham,Aslamalaikkum....insha allah tohar beeen muht albi mufti mahfuuz...meaning same here....
938,spam,"Urgent! call 09061749602 from Landline. Your complimentary 4* Tenerife Holiday or å£10,000 cash await collection SAE T&Cs BOX 528 HP20 1YF 150ppm 18+"
60,ham,Your gonna have to pick up a $1 burger for yourself on your way home. I can't even move. Pain is killing me.
1240,ham,Oh yes I can speak txt 2 u no! Hmm. Did u get  email?
4660,ham,Ok no prob...
2120,ham,"Argh my 3g is spotty, anyway the only thing I remember from the research we did was that province and sterling were the only problem-free places we looked at"
1524,ham,Hi:)cts employee how are you?
153,ham,As per your request 'Melle Melle (Oru Minnaminunginte Nurungu Vettam)' has been set as your callertune for all Callers. Press *9 to copy your friends Callertune
481,ham,"Yo carlos, a few friends are already asking me about you, you working at all this weekend?"
3920,ham,"Do 1 thing! Change that sentence into: \Because i want 2 concentrate in my educational career im leaving here..\"""""
1762,ham,Sometimes Heart Remembrs someone Very much... Forgets someone soon... Bcoz Heart will not like everyone. But liked ones will be Remembered Everytime... BSLVYL
750,spam,"Do you realize that in about 40 years, we'll have thousands of old ladies running around with tattoos?"
1785,ham,I dun believe u. I thk u told him.
2711,ham,"Wen ur lovable bcums angry wid u, dnt take it seriously.. Coz being angry is d most childish n true way of showing deep affection, care n luv!.. kettoda manda... Have nice day da."
4507,ham,Not able to do anything.
4193,ham,Can not use foreign stamps in this country.
1333,ham,"Oh... Icic... K lor, den meet other day..."
4962,ham,I want to see your pretty pussy...
2854,ham,Your gonna be the death if me. I'm gonna leave a note that says its all robs fault. Avenge me.
186,ham,"Haha awesome, be there in a minute"
1136,spam,Dont forget you can place as many FREE Requests with 1stchoice.co.uk as you wish. For more Information call 08707808226.
2058,ham,Ugh fuck it I'm resubbing to eve
4672,ham,I forgot 2 ask Ì_ all smth.. There's a card on da present lei... How? ÌÏ all want 2 write smth or sign on it?
148,ham,K..i deleted my contact that why?
4124,ham,May b approve panalam...but it should have more posts..
3363,ham,"Yo my trip got postponed, you still stocked up?"
2866,ham,"Mum, i've sent you many many messages since i got here. I just want to know that you are actually getting them. Do enjoy the rest of your day."
3776,spam,"Mila, age23, blonde, new in UK. I look sex with UK guys. if u like fun with me. Text MTALK to 69866.18 . 30pp/txt 1st 5free. å£1.50 increments. Help08718728876"
1386,ham,All e best 4 ur exam later.
5271,ham,So u wan 2 come for our dinner tonight a not?
4614,spam,Sunshine Quiz! Win a super Sony DVD recorder if you canname the capital of Australia? Text MQUIZ to 82277. B
3629,spam,Get the official ENGLAND poly ringtone or colour flag on yer mobile for tonights game! Text TONE or FLAG to 84199. Optout txt ENG STOP Box39822 W111WX å£1.50
5019,ham,"It's cool, we can last a little while. Getting more any time soon?"
3028,ham,What is your record for one night? :)
2969,ham,U should make a fb list
4847,ham,S.this will increase the chance of winning.
1708,ham,"How's my loverboy doing ? What does he do that keeps him from coming to his Queen, hmmm ? Doesn't he ache to speak to me ? Miss me desparately ?"
2953,ham,"Think i might have to give it a miss. Am teaching til twelve, then have lecture at two. Damn this working thing."
454,spam,"Loan for any purpose å£500 - å£75,000. Homeowners + Tenants welcome. Have you been previously refused? We can still help. Call Free 0800 1956669 or text back 'help'"
609,ham,"It's fine, imma get a drink or somethin. Want me to come find you?"
4263,ham,She just broke down a list of reasons why nobody's in town and I can't tell if she's being sarcastic or just faggy
4728,ham,I've reached already.
2074,ham,Yar lor actually we quite fast... Cos da ge slow wat... Haha...
4052,ham,I was slept that time.you there?
4534,ham,IM LATE TELLMISS IM ON MY WAY
1622,spam,U have a secret admirer who is looking 2 make contact with U-find out who they R*reveal who thinks UR so special-call on 09058094599
4889,ham,Sounds like there could be a lot of time spent in that chastity device boy ... *grins* ... Or take your beatings like a good dog. Going to lounge in a nice long bath now ?
40,ham,Pls go ahead with watts. I just wanted to be sure. Do have a great weekend. Abiola
2089,ham,"No i'm not. I can't give you everything you want and need. You actually could do better for yourself on yor own--you've got more money than i do. I can't get work, i can't get a man, i can't pay the rent, i can't even fill my fucking gas tank. yes, i'm stressed and depressed. I didn't even call home for thanksgiving cuz i'll have to tell them i,m up to nothing."
3924,ham,As if i wasn't having enough trouble sleeping.
2175,ham,I'm at work. Please call
74,ham,U can call me now...
4464,ham,"\CHEERS FOR CALLIN BABE.SOZI CULDNT TALKBUT I WANNATELL U DETAILS LATER WENWECAN CHAT PROPERLY X\"""""
5492,spam,Marvel Mobile Play the official Ultimate Spider-man game (å£4.50) on ur mobile right now. Text SPIDER to 83338 for the game & we ll send u a FREE 8Ball wallpaper
2657,ham,Dai  &lt;#&gt;  naal eruku.
3180,ham,"So many people seems to be special at first sight, But only very few will remain special to you till your last sight.. Maintain them till life ends.. take cr da"
2076,ham,"Trust me. Even if isn't there, its there."
441,ham,You were supposed to wake ME up &gt;:(
2051,ham,Hey darlin.. i can pick u up at college if u tell me wen & where 2 mt.. love Pete xx
2541,ham,I dont. Can you send it to me. Plus how's mode.
1301,ham,I tot u reach liao. He said t-shirt.
3430,ham,Yeah if we do have to get a random dude we need to change our info sheets to PARTY  &lt;#&gt; /7 NEVER STUDY just to be safe
1304,ham,Your right! I'll make the appointment right now.
236,ham,Or ill be a little closer like at the bus stop on the same street
4648,ham,"Please protect yourself from e-threats. SIB never asks for sensitive information like Passwords,ATM/SMS PIN thru email. Never share your password with anybody."
2599,ham,"Gosh that , what a pain. Spose I better come then."
2573,spam,"Congrats 2 mobile 3G Videophones R yours. call 09063458130 now! videochat wid ur mates, play java games, Dload polypH music, noline rentl. bx420. ip4. 5we. 150p"
3280,ham,I tot it's my group mate... Lucky i havent reply... Wat time do Ì_ need to leave... 
3186,ham,Howz that persons story
3953,ham,I probably won't eat at all today. I think I'm gonna pop. How was your weekend? Did u miss me?
2768,ham,I am on the way to ur home
4223,ham,Double eviction this week - Spiral and Michael and good riddance to them!
2106,ham,Thank you. I like you as well...
2679,spam,"New Tones This week include: 1)McFly-All Ab.., 2) Sara Jorge-Shock.. 3) Will Smith-Switch.. To order follow instructions on next message"
2761,ham,I am not sure about night menu. . . I know only about noon menu
1387,ham,Hope ur head doesn't hurt 2 much ! Am ploughing my way through a pile of ironing ! Staying in with a chinky tonight come round if you like.
5233,ham,Hey what how about your project. Started aha da.
5045,ham,Desires- u going to doctor 4 liver. And get a bit stylish. Get ur hair managed. Thats it.
1279,ham,Waiting 4 my tv show 2 start lor... U leh still busy doing ur report?
5458,ham,"Sorry, I'll call later"
1555,ham,Ok i found dis pierre cardin one which looks normal costs 20 its on sale.
3190,spam,UR awarded a City Break and could WIN a å£200 Summer Shopping spree every WK. Txt STORE to 88039.SkilGme.TsCs087147403231Winawk!Age16+å£1.50perWKsub
5228,spam,PRIVATE! Your 2003 Account Statement for <fone no> shows 800 un-redeemed S. I. M. points. Call 08715203656 Identifier Code: 42049 Expires 26/10/04
3594,ham,Huh but i cant go 2 ur house empty handed right?
1920,ham,Dont know you bring some food
513,ham,No..jst change tat only..
4177,ham,Two teams waiting for some players
1308,ham,I jokin oni lar.. ÌÏ busy then i wun disturb Ì_.
914,ham,"Call me da, i am waiting for your call."
3452,ham,"Nowadays people are notixiquating the laxinorficated opportunity for bambling of entropication.... Have you ever oblisingately opted ur books for the masteriastering amplikater of fidalfication? It is very champlaxigating, i think it is atrocious.. Wotz Ur Opinion???? Junna"
3695,ham,I am in tirupur.  call you da.
4242,ham,Okie...
3156,ham,Havent shopping now lor i juz arrive only
2198,ham,I'm in a movie. Call me 4 wat?
774,ham,Just sleeping..and surfing
4425,ham,Was it something u ate?
943,ham,And also I've sorta blown him off a couple times recently so id rather not text him out of the blue looking for weed
822,spam,"SMSSERVICES. for yourinclusive text credits, pls goto www.comuk.net login= 3qxj9 unsubscribe with STOP, no extra charge. help 08702840625.COMUK. 220-CM2 9AE"
4277,ham,I've reached home finally...
164,spam,"BangBabes Ur order is on the way. U SHOULD receive a Service Msg 2 download UR content. If U do not, GoTo wap. bangb. tv on UR mobile internet/service menu"
3983,ham,"Hey, I missed you tm of last night as my phone was on the charge ... *smiles* ... I am meeting a friend shortly"
2538,ham,The monthly amount is not that terrible and you will not pay anything till 6months after finishing school.
5320,ham,But we havent got da topic yet rite?
1311,ham,U r too much close to my heart. If u go away i will be shattered. Plz stay with me.
5411,ham,I ask if u meeting da ge tmr nite...
4650,spam,A å£400 XMAS REWARD IS WAITING FOR YOU! Our computer has randomly picked you from our loyal mobile customers to receive a å£400 reward. Just call 09066380611 
5175,ham,Raji..pls do me a favour. Pls convey my Birthday wishes to Nimya. Pls. Today is her birthday.
3300,spam,RCT' THNQ Adrian for U text. Rgds Vatian
3310,ham,HI DARLIN HOW WAS WORK DID U GET INTO TROUBLE? IJUST TALKED TO YOUR MUM ALL MORNING! I HAD A REALLY GOOD TIME LAST NIGHT IM GOIN OUT SOON BUT CALL ME IF U CAN
327,ham,"I'd say that's a good sign but, well, you know my track record at reading women"
2490,ham,Dun b sad.. It's over.. Dun thk abt it already. Concentrate on ur other papers k.
5223,ham,If I die I want u to have all my stuffs.
4408,spam,"For your chance to WIN a FREE Bluetooth Headset then simply reply back with \ADP\"""""
832,spam,"Dear Voucher Holder, To claim this weeks offer, at you PC please go to http://www.e-tlp.co.uk/expressoffer Ts&Cs apply. To stop texts, txt STOP to 80062"
3079,ham,S.s:)i thinl role is like sachin.just standing. Others have to hit.
3462,ham,i am seeking a lady in the street and a freak in the sheets. Is that you?
4890,ham,Its worse if if uses half way then stops. Its better for him to complete it.
54,spam,SMS. ac Sptv: The New Jersey Devils and the Detroit Red Wings play Ice Hockey. Correct or Incorrect? End? Reply END SPTV
4064,ham,Dont kick coco when he's down
3451,ham,Ugh just got outta class
1901,ham,"Sorry, I'll call later"
1481,ham,"I'm a guy, browsin is compulsory"
4150,ham,ÌÏ comin to fetch us oredi...
3335,ham,Then u go back urself lor...
946,spam,Ur cash-balance is currently 500 pounds - to maximize ur cash-in now send GO to 86688 only 150p/msg. CC: 08718720201 PO BOX 114/14 TCR/W1
3293,ham,"Beautiful tomorrow never comes.. When it comes, it's already TODAY.. In the hunt of beautiful tomorrow don't waste your wonderful TODAY.. GOODMORNING:)"
2161,ham,Is she replying. Has boye changed his phone number
4724,ham,"There'll be a minor shindig at my place later tonight, you interested?"
3057,spam,You are now unsubscribed all services. Get tons of sexy babes or hunks straight to your phone! go to http://gotbabes.co.uk. No subscriptions.
768,ham,I cant pick the phone right now. Pls send a message
5241,ham,Its a part of checking IQ
3495,ham,Happy birthday... May u find ur prince charming soon n dun work too hard...
285,ham,"K, I might come by tonight then if my class lets out early"
5501,spam,PRIVATE! Your 2003 Account Statement for 07808247860 shows 800 un-redeemed S. I. M. points. Call 08719899229 Identifier Code: 40411 Expires 06/11/04
4959,ham,I want  &lt;#&gt;  rs da:)do you have it?
2332,ham,We are both fine. Thanks
2717,ham,Okie.. Thanx..
2079,ham,I can take you at like noon
3389,spam,Please CALL 08712402972 immediately as there is an urgent message waiting for you
722,ham,That is wondar full flim.
951,ham,Shb b ok lor... Thanx...
4862,spam,Bored housewives! Chat n date now! 0871750.77.11! BT-national rate 10p/min only from landlines!
2262,ham,It should take about  &lt;#&gt;  min
989,ham,Ugh. Gotta drive back to sd from la. My butt is sore.
3212,ham,What's ur pin?
1759,ham,Do u ever get a song stuck in your head for no reason and it won't go away til u listen to it like 5 times?
4575,spam,Congratulations ur awarded 500 of CD vouchers or 125gift guaranteed & Free entry 2 100 wkly draw txt MUSIC to 87066
4422,ham,alright. Thanks for the advice. Enjoy your night out. I'ma try to get some sleep...
1724,ham,There bold 2  &lt;#&gt; . Is that yours
341,ham,I take it the post has come then! You must have 1000s of texts now! Happy reading. My one from wiv hello caroline at the end is my favourite. Bless him
3701,ham,Hey loverboy! I love you !! I had to tell ... I look at your picture and ache to feel you between my legs ... Fuck I want you ... I need you ... I crave you .
4243,ham,"Aight, I'm chillin in a friend's room so text me when you're on the way"
688,ham,Thanks love. But am i doing torch or bold.
3432,ham,"Christmas is An occasion that is Celebrated as a Reflection of UR... Values..., Desires..., Affections...&amp; Traditions.... Have an ideal Christmas..."
966,ham,I am not sure about night menu. . . I know only about noon menu
5267,ham,Anything lar then Ì_ not going home 4 dinner?
2203,ham,soon you will have the real thing princess! Do i make you wet? :)
2713,ham,Nope i'm not drivin... I neva develop da photos lei...
4915,ham,"Just dropped em off, omw back now"
5102,spam,This msg is for your mobile content order It has been resent as previous attempt failed due to network error Queries to customersqueries@netvision.uk.com
3572,spam,You won't believe it but it's true. It's Incredible Txts! Reply G now to learn truly amazing things that will blow your mind. From O2FWD only 18p/txt
1990,ham,HI DARLIN IVE JUST GOT BACK AND I HAD A REALLY NICE NIGHT AND THANKS SO MUCH FOR THE LIFT SEE U TOMORROW XXX
4120,ham,Yunny... I'm goin to be late
4570,ham,\CHA QUITEAMUZING THATåÕSCOOL BABE
5284,ham,Sent me ur email id soon
3600,ham,"Jay told me already, will do"
5251,ham,"Yeah work is fine, started last week, all the same stuff as before, dull but easy and guys are fun!"
5546,ham,Ic. There are a lotta childporn cars then.
4594,ham,Yo sorry was in the shower sup
385,ham,It took Mr owl 3 licks
4865,ham,"Oh! Shit, I thought that was your trip! Loooooool ... That just makes SO much more sense now ... *grins* and the sofa reference was ... The \sleep on a couch\"" link you sent me ... Wasn't that how you went on your trip ? Oh ... And didn't your babe go with you for that celebration with your rents?"""
5090,ham,"St andre, virgil's cream"
536,ham,"Probably gonna be here for a while, see you later tonight &lt;)"
5200,spam,Call Germany for only 1 pence per minute! Call from a fixed line via access number 0844 861 85 85. No prepayment. Direct access! www.telediscount.co.uk
4212,ham,I attended but nothing is there.
3507,ham,"Camera quite good, 10.1mega pixels, 3optical and 5digital dooms. Have a lovely holiday, be safe and i hope you hav a good journey! Happy new year to you both! See you in a couple of weeks! "
201,ham,Hello darlin ive finished college now so txt me when u finish if u can love Kate xxx
1332,ham,It's ok lar. U sleep early too... Nite...
3502,ham,Free any day but i finish at 6 on mon n thurs...
2708,ham,"Nah, I'm a perpetual DD"
4021,ham,U gd lor go shopping i got stuff to do. U wan 2 watch infernal affairs a not? Come lar...
