,labels,text
2562,ham,"Yeah I am, so I'll leave maybe 7ish?"
3027,ham,You have got tallent but you are wasting.
5112,spam,December only! Had your mobile 11mths+? You are entitled to update to the latest colour camera mobile for Free! Call The Mobile Update VCo FREE on 08002986906 
1423,ham,Lol great now im getting hungry.
656,ham,"Sun cant come to earth but send luv as rays. cloud cant come to river but send luv as rain. I cant come to meet U, but can send my care as msg to U. Gud evng"
3968,ham,Thanks for your message. I really appreciate your sacrifice. I'm not sure of the process of direct pay but will find out on my way back from the test tomorrow. I'm in class now. Do have a wonderful day.
5137,spam,"YOU VE WON! Your 4* Costa Del Sol Holiday or å£5000 await collection. Call 09050090044 Now toClaim. SAE, TC s, POBox334, Stockport, SK38xh, Costå£1.50/pm, Max10mins"
2102,ham,Audrie lousy autocorrect
632,ham,Oh that was a forwarded message. I thought you send that to me
3578,ham,"Multiply the numbers independently and count decimal points then, for the division, push the decimal places like i showed you."
2493,ham,they released another Italian one today and it has a cosign option
2665,ham,R u meeting da ge at nite tmr?
3984,ham,"Whatever, juliana. Do whatever you want."
4316,ham,HIYA STU WOT U UP 2.IM IN SO MUCH TRUBLE AT HOME AT MOMENT EVONE HATES ME EVEN U! WOT THE HELL AV I DONE NOW? Y WONT U JUST TELL ME TEXT BCK PLEASE LUV DAN 
4091,ham,I remain unconvinced that this isn't an elaborate test of my willpower
3834,ham,I'm thinking that chennai forgot to come for auction..
3833,ham,Watching tv lor. Nice one then i like lor.
4275,ham,Can you please send me my aunty's number
2500,ham,Remember to ask alex about his pizza
1465,spam,"YOU 07801543489 are guaranteed the latests Nokia Phone, a 40GB iPod MP3 player or a å£500 prize! Txt word:COLLECT to No:83355! TC-LLC NY-USA 150p/Mt msgrcvd18+"
3501,ham,I will come to ur home now
4508,ham,ÌÏ takin linear algebra today?
115,ham,"As I entered my cabin my PA said, '' Happy B'day Boss !!''. I felt special. She askd me 4 lunch. After lunch she invited me to her apartment. We went there."
1821,ham,I couldn't say no as he is a dying man and I feel sad for him so I will go and I just wanted you to know I would probably be gone late into your night
1494,ham,It has everything to do with the weather. Keep extra warm. Its a cold but nothing serious. Pls lots of vitamin c
2401,spam,Babe: U want me dont u baby! Im nasty and have a thing 4 filthyguys. Fancy a rude time with a sexy bitch. How about we go slo n hard! Txt XXX SLO(4msgs)
1232,ham,1's finish meeting call me.
2661,ham,Do you know when dad will be back?
2817,ham,Thk some of em find wtc too far... Weiyi not goin... E rest i dunno yet... R ur goin 4 dinner den i might b able to join...
3551,ham,Lol u still feeling sick?
5094,ham,"Hi Shanil,Rakhesh here.thanks,i have exchanged the uncut diamond stuff.leaving back. Excellent service by Dino and Prem."
1153,spam,1000's of girls many local 2 u who r virgins 2 this & r ready 2 4fil ur every sexual need. Can u 4fil theirs? text CUTE to 69911(å£1.50p. m)
5316,ham,Jus finish watching tv... U?
4954,ham,Doing my masters. When will you buy a bb cos i have for sale and how's bf
57,ham,"Sorry, I'll call later in meeting."
4157,ham,It certainly puts things into perspective when something like this happens
5098,spam,"TheMob>Hit the link to get a premium Pink Panther game, the new no. 1 from Sugababes, a crazy Zebra animation or a badass Hoody wallpaper-all 4 FREE!"
4770,ham,Hi..i got the money da:)
5509,ham,Lol they were mad at first but then they woke up and gave in.
1735,ham,Why tired what special there you had
5023,ham,Where you. What happen
2823,ham,No need to buy lunch for me.. I eat maggi mee..
2196,ham,"Not much, just some textin'. How bout you?"
159,spam,You are a winner U have been specially selected 2 receive å£1000 cash or a 4* holiday (flights inc) speak to a live operator 2 claim 0871277810810
2475,ham,Mm i am on the way to railway
2564,ham,"Under the sea, there lays a rock. In the rock, there is an envelope. In the envelope, there is a paper. On the paper, there are 3 words... '"
3996,spam,Bored housewives! Chat n date now! 0871750.77.11! BT-national rate 10p/min only from landlines!
3657,ham,R u here yet? I'm wearing blue shirt n black pants.
2608,ham,Hello madam how are you ?
4311,ham,I keep ten rs in my shelf:) buy two egg.
707,ham,Quite late lar... Ard 12 anyway i wun b drivin...
3046,ham,"Ok. Not much to do here though. H&M Friday, cant wait. Dunno wot the hell im gonna do for another 3 weeks! Become a slob- oh wait, already done that! "
4761,ham,Me too! Have a lovely night xxx
1093,ham,"Well the weather in cali's great. But its complexities are great. You need a car to move freely, its taxes are outrageous. But all in all its a great place. The sad part is i missing home."
4257,ham,I am late. I will be there at
1376,ham,Auntie huai juan never pick up her phone
5473,ham,Ok lor Ì_ reaching then message me.
72,ham,HI BABE IM AT HOME NOW WANNA DO SOMETHING? XX
1922,ham,I'll be in sch fr 4-6... I dun haf da book in sch... It's at home...
3928,ham,Yes. Nigh you cant aha.
1764,spam,Hi 07734396839 IBH Customer Loyalty Offer: The NEW NOKIA6600 Mobile from ONLY å£10 at TXTAUCTION!Txt word:START to No:81151 & get Yours Now!4T&
743,ham,Ok. There may be a free gym about.
3557,ham,No da. . Vijay going to talk in jaya tv
1005,ham,Give me a sec to think think about it
2668,spam,Wanna get laid 2nite? Want real Dogging locations sent direct to ur mobile? Join the UK's largest Dogging Network. Txt PARK to 69696 now! Nyt. ec2a. 3lp å£1.50/msg
1190,ham,We're done...
3950,ham,Hi dude hw r u da realy mising u today
2601,ham,Okie
1125,spam,For taking part in our mobile survey yesterday! You can now have 500 texts 2 use however you wish. 2 get txts just send TXT to 80160 T&C www.txt43.com 1.50p
1241,ham,"I want to show you the world, princess :) how about europe?"
3523,ham,Yeah that'd pretty much be the best case scenario
4600,spam,FreeMsg: Txt: CALL to No: 86888 & claim your reward of 3 hours talk time to use from your phone now! Subscribe6GBP/mnth inc 3hrs 16 stop?txtStop
5252,ham,You do your studies alone without anyones help. If you cant no need to study.
3351,ham,Call him and say you not coming today ok and tell them not to fool me like this ok
998,ham,Then Ì_ wait 4 me at bus stop aft ur lect lar. If i dun c Ì_ then i go get my car then come back n pick Ì_.
4399,ham,Juz go google n search 4 qet...
3518,ham,Hanging out with my brother and his family
2684,ham,Yupz... I've oredi booked slots 4 my weekends liao... 
4834,ham,"OH RITE. WELL IM WITH MY BEST MATE PETE, WHO I WENT OUT WITH 4 A WEEK+ NOW WERE 2GEVA AGAIN. ITS BEEN LONGER THAN A WEEK."
1577,ham,"Remember all those whom i hurt during days of satanic imposter in me.need to pay a price,so be it.may destiny keep me going and as u said pray that i get the mind to get over the same."
5337,ham,My birthday is on feb  &lt;#&gt;  da. .
1826,ham,"Dude. What's up. How Teresa. Hope you have been okay. When i didnt hear from these people, i called them and they had received the package since dec  &lt;#&gt; . Just thot you'ld like to know. Do have a fantastic year and all the best with your reading. Plus if you can really really Bam first aid for Usmle, then your work is done."
4073,ham,A lot of this sickness thing going round. Take it easy. Hope u feel better soon. Lol
5557,ham,No. I meant the calculation is the same. That  &lt;#&gt; units at  &lt;#&gt; . This school is really expensive. Have you started practicing your accent. Because its important. And have you decided if you are doing 4years of dental school or if you'll just do the nmde exam.
4299,ham,"Erm... Woodland avenue somewhere. Do you get the parish magazine, his telephone number will be in there."
4606,ham,Been running but only managed 5 minutes and then needed oxygen! Might have to resort to the roller option!
440,ham,Yes..he is really great..bhaji told kallis best cricketer after sachin in world:).very tough to get out.
5515,ham,You are a great role model. You are giving so much and i really wish each day for a miracle but God as a reason for everything and i must say i wish i knew why but i dont. I've looked up to you since i was young and i still do. Have a great day.
1100,ham,You busy or can I come by at some point and figure out what we're doing tomorrow
2637,ham,No I don't have cancer. Moms making a big deal out of a regular checkup aka pap smear
3786,ham,WHORE YOU ARE UNBELIEVABLE.
649,spam,"You have won ?1,000 cash or a ?2,000 prize! To claim, call09050000327. T&C: RSTM, SW7 3SS. 150ppm"
1546,ham,Shant disturb u anymore... Jia you...
3231,ham,Guess he wants alone time. We could just show up and watch when they do..
4240,ham,Detroit. The home of snow. Enjoy it.
4256,spam,important information 4 orange user . today is your lucky day!2find out why log onto http://www.urawinner.com THERE'S A FANTASTIC SURPRISE AWAITING YOU!
3917,ham,No need to ke qi... ÌÏ too bored izzit y suddenly thk of this...
5508,ham,"Machan you go to gym tomorrow,  i wil come late goodnight."
4361,ham,"I can't right this second, gotta hit people up first"
630,ham,Please dont say like that. Hi hi hi
672,spam,Get ur 1st RINGTONE FREE NOW! Reply to this msg with TONE. Gr8 TOP 20 tones to your phone every week just å£1.50 per wk 2 opt out send STOP 08452810071 16
1249,ham,"I call you later, don't have network. If urgnt, sms me."
3567,ham,Sent me de webadres for geting salary slip
482,ham,Watching tv lor...
1584,ham,"Sorry, I'll call later"
3805,spam,URGENT! We are trying to contact you. Last weekends draw shows that you have won a å£900 prize GUARANTEED. Call 09061701851. Claim code K61. Valid 12hours only
5154,ham,"Like  &lt;#&gt; , same question"
3765,ham,Yes.mum lookin strong:)
1462,spam,"09066362231 URGENT! Your mobile No 07xxxxxxxxx won a å£2,000 bonus caller prize on 02/06/03! this is the 2nd attempt to reach YOU! call 09066362231 ASAP!"
3040,ham,Aight what time you want me to come up?
4473,spam,Want explicit SEX in 30 secs? Ring 02073162414 now! Costs 20p/min
4290,ham,Call me when u're done...
5547,spam,"Had your contract mobile 11 Mnths? Latest Motorola, Nokia etc. all FREE! Double Mins & Text on Orange tariffs. TEXT YES for callback, no to remove from records."
3273,ham,Thanx a lot...
3238,ham,Am okay. Will soon be over. All the best
3131,ham,I've been barred from all B and Q stores for life!?This twat in orange dungerees came up to me and asked if I wanted decking? So I got the first punch in!!
2578,ham,Erm. I thought the contract ran out the4th of october.
4398,ham,Yes just finished watching days of our lives. I love it.
49,ham,U don't know how stubborn I am. I didn't even want to go to the hospital. I kept telling Mark I'm not a weak sucker. Hospitals are for weak suckers.
4771,ham,"Hi, Mobile no.  &lt;#&gt;  has added you in their contact list on www.fullonsms.com It s a great place to send free sms to people For more visit fullonsms.com"
3784,ham,Let me know if you need anything else. Salad or desert or something... How many beers shall i get?
858,ham,Spoons it is then okay?
3225,ham,"Rose for red,red for blood,blood for heart,heart for u. But u for me.... Send tis to all ur friends.. Including me.. If u like me.. If u get back, 1-u r poor in relation! 2-u need some 1 to support 3-u r frnd 2 many 4-some1 luvs u 5+- some1 is praying god to marry u.:-) try it...."
1072,spam,Dear U've been invited to XCHAT. This is our final attempt to contact u! Txt CHAT to 86688
719,ham,Macha dont feel upset.i can assume your mindset.believe me one evening with me and i have some wonderful plans for both of us.LET LIFE BEGIN AGAIN.call me anytime
3910,ham,How i noe... She's in da car now... Later then c lar... I'm wearing shorts...
2631,spam,"URGENT! Your mobile No 077xxx WON a å£2,000 Bonus Caller Prize on 02/06/03! This is the 2nd attempt to reach YOU! Call 09066362206 ASAP! BOX97N7QP, 150ppm"
5428,ham,You didnt complete your gist oh.
1660,ham,No just send to you. Bec you in temple na.
1656,ham,Yes I posted a couple of pics on fb. There's still snow outside too. I'm just waking up :)
2425,ham,Hey!!! I almost forgot ... Happy B-day babe ! I love ya!!
4233,ham,Now only i reached home. . . I am very tired now. . I will come tomorro
4704,ham,Hey anyway i have to :-)
5540,spam,ASKED 3MOBILE IF 0870 CHATLINES INCLU IN FREE MINS. INDIA CUST SERVs SED YES. L8ER GOT MEGA BILL. 3 DONT GIV A SHIT. BAILIFF DUE IN DAYS. I O å£250 3 WANT å£800
4094,ham,I ain't answerin no phone at what is actually a pretty reasonable hour but I'm sleepy
3097,ham,This is all just creepy and crazy to me.
4990,ham,"We made it! Eta at taunton is 12:30 as planned, hope thatÛ÷s still okday?! Good to see you! :-xx"
4088,ham,"How are you, my Love ? Are you with your brother ? Time to talk english with him ? *grins* Say : Hey Muhommad, Penny says hello from across the sea"
5295,ham,Alex says he's not ok with you not being ok with it
3189,ham,Hi neva worry bout da truth coz the truth will lead me 2 ur heart. ItåÕs the least a unique person like u deserve. Sleep tight or morning
2934,ham,"Yeah, we got one lined up for us"
4596,ham,Full heat pa:-) i have applyed oil pa.
3848,ham,U in town alone?
2606,ham,R U &SAM P IN EACHOTHER. IF WE MEET WE CAN GO 2 MY HOUSE
1385,ham,That's ok. I popped in to ask bout something and she said you'd been in. Are you around tonght wen this girl comes?
4421,ham,MMM ... Fuck .... Merry Christmas to me
1399,ham,You have registered Sinco as Payee. Log in at icicibank.com and enter URN  &lt;#&gt;  to confirm. Beware of frauds. Do NOT share or disclose URN to anyone.
1195,spam,You have 1 new voicemail. Please call 08719181503
1408,ham,"I've got ten bucks, jay is being noncomittal"
1845,ham,Hi. || Do u want | to join me with sts later? || Meeting them at five. || Call u after class.
1798,ham,That one week leave i put know that time. Why.
1475,ham,"Nice. Wait...should you be texting right now? I'm not gonna pay your ticket, ya know!"
3985,ham,"Friendship is not a game to play, It is not a word to say, It doesn\'t start on March and ends on May, It is tomorrow, yesterday, today and e"
35,ham,Yup... Ok i go home look at the timings then i msg Ì_ again... Xuhui going to learn on 2nd may too but her lesson is at 8am
4525,spam,"I want some cock! My hubby's away, I need a real man 2 satisfy me. Txt WIFE to 89938 for no strings action. (Txt STOP 2 end, txt rec å£1.50ea. OTBox 731 LA1 7WS. )"
2345,ham,"Hi this is yijue, can i meet u at 11 tmr?"
3932,ham,"Playin space poker, u?"
3312,ham,"Huh... Hyde park not in mel ah, opps, got confused... Anyway, if tt's e best choice den we juz have to take it..."
2359,spam,"Spook up your mob with a Halloween collection of a logo & pic message plus a free eerie tone, txt CARD SPOOK to 8007 zed 08701417012150p per logo/pic"
3006,ham,Ah you see. You have to be in the lingo. I will let you know wot on earth it is when has finished making it!
2206,spam,"URGENT! Your mobile No 07xxxxxxxxx won a å£2,000 bonus caller prize on 02/06/03! this is the 2nd attempt to reach YOU! call 09066362231 ASAP! BOX97N7QP, 150PPM"
5384,ham,How are you babes. Hope your doing ok. I had a shit nights sleep. I fell asleep at 5.IåÕm knackered and iåÕm dreading work tonight. What are thou upto tonight. X
4778,ham,O we cant see if we can join denis and mina? Or does denis want alone time
3179,ham,There the size of elephant tablets & u shove um up ur ass!!
3422,spam,Had your mobile 10 mths? Update to latest Orange camera/video phones for FREE. Save å£s with Free texts/weekend calls. Text YES for a callback orno to opt out
1286,ham,"Night has ended for another day, morning has come in a special way. May you smile like the sunny rays and leaves your worries at the blue blue bay. Gud mrng"
4995,ham,Happy new year. Hope you are having a good semester
349,ham,Just checking in on you. Really do miss seeing Jeremiah. Do have a great month
3416,ham,But i haf enuff space got like 4 mb...
2137,ham,Then why you came to hostel.
2691,ham,Hey tmr meet at bugis 930 ?
3905,ham,Went fast asleep dear.take care.
3868,ham,No let me do the math. Your not good at it.
1681,ham,Y lei?
4521,ham,DO U WANT 2 MEET UP 2MORRO
1443,spam,Free 1st week entry 2 TEXTPOD 4 a chance 2 win 40GB iPod or å£250 cash every wk. Txt POD to 84128 Ts&Cs www.textpod.net custcare 08712405020.
4016,ham,Eek that's a lot of time especially since American Pie is like 8 minutes long. I can't stop singing it.
3215,spam,URGENT! We are trying to contact U. Todays draw shows that you have won a å£2000 prize GUARANTEED. Call 09066358361 from land line. Claim Y87. Valid 12hrs only
1671,ham,Glad to see your reply.
3650,ham,Want to send me a virtual hug?... I need one
1179,ham,To day class is there are no class.
2798,ham,I've told him that i've returned it. That should i re order it.
1692,ham,Weightloss! No more girl friends. Make loads of money on ebay or something. And give thanks to God.
4444,ham,"2 celebrate my båÕday, y else?"
372,ham,I'm going for bath will msg you next  &lt;#&gt;  min..
3055,ham,Webpage s not available!
4286,ham,I wud never mind if u dont miss me or if u dont need me.. But u wil really hurt me wen u need me &amp; u dont tell me......... Take care:-)
1916,ham,Fffff. Can you text kadeem or are you too far gone
1357,ham,"Good afternoon loverboy ! How goes you day ? Any luck come your way? I think of you, sweetie and send my love across the sea to make you smile and happy"
1825,ham,Wat makes some people dearer is not just de happiness dat u feel when u meet them but de pain u feel when u miss dem!!!
786,ham,It does it on its own. Most of the time it fixes my spelling. But sometimes it gets a completely diff word. Go figure
469,ham,There are many company. Tell me the language.
140,ham,"K, text me when you're on the way"
788,spam,"5 Free Top Polyphonic Tones call 087018728737, National Rate. Get a toppoly tune sent every week, just text SUBPOLY to 81618, å£3 per pole. UnSub 08718727870."
323,ham,That would be great. We'll be at the Guild. Could meet on Bristol road or somewhere - will get in touch over weekend. Our plans take flight! Have a good week
50,ham,What you thinked about me. First time you saw me in class.
714,ham,He also knows about lunch menu only da. . I know
5004,ham,Guess which pub im in? Im as happy as a pig in clover or whatever the saying is! 
2840,ham,Ok thanx...
2446,ham,"Sorry, I'll call later"
5360,ham,"Hey, iouri gave me your number, I'm wylie, ryan's friend"
4089,spam,We tried to call you re your reply to our sms for a video mobile 750 mins UNLIMITED TEXT + free camcorder Reply of call 08000930705 Now
4926,ham,Wanna do some art?! :D
5118,ham,Are you driving or training?
5202,ham,WOT STUDENT DISCOUNT CAN U GET ON BOOKS?
2666,ham,"* Was a nice day and, impressively, i was sensible, went home early and now feel fine. Or am i just boring?! When's yours, i can't remember."
406,ham,All was well until slightly disastrous class this pm with my fav darlings! Hope day off ok. Coffee wld be good as can't stay late tomorrow. Same time + place as always?
20,ham,Is that seriously how you spell his name?
1004,ham,Umma. Did she say anything
5331,ham,X course it 2yrs. Just so her messages on messenger lik you r sending me
890,ham,Why do you ask princess?
2411,ham,"Come to me right now, Ahmad"
2545,ham,So are you guys asking that i get that slippers again or its gone with last year
1349,spam,"FREE2DAY sexy St George's Day pic of Jordan!Txt PIC to 89080 dont miss out, then every wk a saucy celeb!4 more pics c PocketBabe.co.uk 0870241182716 å£3/wk"
2390,ham,First has she gained more than  &lt;#&gt; kg since she took in. Second has she done the blood sugar tests. If she has and its ok and her blood pressure is within normal limits then no worries
4481,ham,"What do u reckon as need 2 arrange transport if u can't do it, thanks"
42,spam,07732584351 - Rodger Burns - MSG = We tried to call you re your reply to our sms for a free nokia mobile + free camcorder. Please call now 08000930705 for delivery tomorrow
2830,ham,Thanx 4 sending me home...
4095,ham,"Hey , is * rite u put åÈ10 evey mnth is that all?"
3371,ham,And now electricity just went out fml.
3022,ham,You are a very very very very bad girl. Or lady.
3364,ham,"Sorry, I'll call later"
303,ham,He is a womdarfull actor
5030,ham,Hey... Very inconvenient for your sis a not huh?
11,spam,"SIX chances to win CASH! From 100 to 20,000 pounds txt> CSH11 and send to 87575. Cost 150p/day, 6days, 16+ TsandCs apply Reply HL 4 info"
664,ham,Yes baby! We can study all the positions of the kama sutra ;)
1177,ham,Just nw i came to hme da..
3292,ham,A little. Meds say take once every 8 hours. It's only been 5 but pain is back. So I took another. Hope I don't die
2676,ham,* Am on a train back from northampton so i'm afraid not!
1947,ham,The battery is for mr adewale my uncle. Aka Egbon
2501,ham,No da..today also i forgot..
1473,ham,"Will do, you gonna be at blake's all night? I might be able to get out of here a little early"
2863,ham,What I'm saying is if you haven't explicitly told nora I know someone I'm probably just not gonna bother
2375,ham,Thanx 4 2day! U r a goodmate I THINK UR RITE SARY! ASUSUAL!1 U CHEERED ME UP! LOVE U FRANYxxxxx
2132,spam,Your B4U voucher w/c 27/03 is MARSMS. Log onto www.B4Utele.com for discount credit. To opt out reply stop. Customer care call 08717168528
1026,ham,Yes da. Any plm at ur office
2989,ham,"Love isn't a decision, it's a feeling. If we could decide who to love, then, life would be much simpler, but then less magical"
961,spam,URGENT! We are trying to contact U. Todays draw shows that you have won a å£800 prize GUARANTEED. Call 09050001808 from land line. Claim M95. Valid12hrs only
2889,ham,Shuhui has bought ron's present it's a swatch watch...
3021,ham,How dare you change my ring
3015,ham,"&lt;#&gt;  is fast approaching. So, Wish u a very Happy New Year Happy Sankranti Happy republic day Happy Valentines Day Happy Shivratri Happy Ugadi Happy Fools day Happy May Day Happy Independence Day, Happy Friendship,Mother,Father,Teachers,Childrens Day, &amp; HAPPY BIRTHDAY 4 U. Happy Ganesh festival Happy Dasara Happy Diwali Happy Christmas  &lt;#&gt;  Good Mornings Afternoons, Evenings Nights. RememberI AM the first to WISHING U ALL THESE...your's Raj"
3879,ham,Hi juan. Im coming home on fri hey. Of course i expect a welcome party and lots of presents. Ill phone u when i get back. Loads of love nicky x x x x x x x x x
3338,ham,Babe !!!! I LOVE YOU !!!! *covers your face in kisses*
2009,ham,"I can't keep going through this. It was never my intention to run you out, but if you choose to do that rather than keep the room clean so *I* don't have to say no to visitors, then maybe that's the best choice. Yes, I wanted you to be embarassed, so maybe you'd feel for once how I feel when i have a friend who wants to drop buy and i have to say no, as happened this morning. I've tried everything. I don't know what else to do."
2149,ham,Waaaat?? Lololo ok next time then!
1963,ham,Yes :)it completely in out of form:)clark also utter waste.
2338,ham,"Alright, see you in a bit"
3800,ham,"It's ok, at least armand's still around"
735,ham,Then why no one talking to me
304,spam,"SMS. ac Blind Date 4U!: Rodds1 is 21/m from Aberdeen, United Kingdom. Check Him out http://img. sms. ac/W/icmb3cktz8r7!-4 no Blind Dates send HIDE"
1440,ham,"Cool breeze... Bright sun... Fresh flower... Twittering birds... All these waiting to wish u: \GOODMORNING &amp; HAVE A NICE DAY\"" :)"""
1496,ham,I'm always on yahoo messenger now. Just send the message to me and i.ll get it you may have to send it in the mobile mode sha but i.ll get it. And will reply.
2652,ham,No need for the drug anymore.
2875,ham,Fuck cedar key and fuck her (come over anyway tho)
916,ham,Was actually about to send you a reminder today. Have a wonderful weekend
4655,ham,"K, I'll work something out"
710,ham,Height of Confidence: All the Aeronautics professors wer calld &amp; they wer askd 2 sit in an aeroplane. Aftr they sat they wer told dat the plane ws made by their students. Dey all hurried out of d plane.. Bt only 1 didnt move... He said:\if it is made by my students
5152,ham,Idk. I'm sitting here in a stop and shop parking lot right now bawling my eyes out because i feel like i'm a failure in everything. Nobody wants me and now i feel like i'm failing you.
4918,ham,Re your call; You didn't see my facebook huh?
2772,ham,Still in customer place
1624,spam,500 free text msgs. Just text ok to 80488 and we'll credit your account
4423,ham,Update your face book status frequently :)
821,ham,On the road so cant txt
4083,ham,Quite ok but a bit ex... U better go eat smth now else i'll feel guilty...
1354,ham,Baaaaabe! I misss youuuuu ! Where are you ? I have to go and teach my class at 5 ...
5013,ham,Hello boytoy ! Geeee ... I'm missing you today. I like to send you a tm and remind you I'm thinking of you ... And you are loved ... *loving kiss*
850,ham,U reach orchard already? U wan 2 go buy tickets first?
3350,ham,At what time are you coming.
1000,ham,No..but heard abt tat..
5101,ham,Nope thats fine. I might have a nap tho! 
3947,ham,I like to think there's always the possibility of being in a pub later.
4148,ham,"Haven't found a way to get another app for your phone, eh ? Will you go to the net cafe ? Did you take that job? Geeee I need you babe. I crave to see you ..."
3525,ham,\HEY BABE! FAR 2 SPUN-OUT 2 SPK AT DA MO... DEAD 2 DA WRLD. BEEN SLEEPING ON DA SOFA ALL DAY
18,ham,Fine if thatåÕs the way u feel. ThatåÕs the way its gota b
1637,spam,"0A$NETWORKS allow companies to bill for SMS, so they are responsible for their \suppliers\"""
1667,ham,So now my dad is gonna call after he gets out of work and ask all these crazy questions.
493,ham,What class of  &lt;#&gt;  reunion?
